
Thu, 23 Aug 2018 20:43:12 +0200
qemu-system-x86_64 -M q35,accel=kvm -smp 2 -m 4G -cpu host,kvm=off -acpitable file=fakedev.aml -device isa-debugcon,iobase=0x404,chardev=dbug -chardev file,id=dbug,path=/dev/stdout -device isa-debugcon,iobase=0x403,chardev=dbugfw -chardev file,id=dbugfw,path=/dev/stdout -smbios type=0,date=01/01/2018 -device ioh3420,id=rp1,bus=pcie.0,addr=1c.0,port=1 -device vfio-pci,bus=rp1,host=01:00.0,rombar=0,x-pci-sub-vendor-id=0x1028,x-pci-sub-device-id=0x07be -fw_cfg name=opt/nl.lekensteyn/vfio-vbios,file=vbios.rom -netdev user,id=net0 -device e1000,netdev=net0 -vnc :0 -trace vfio_pci_read_config,file=/dev/stdout -trace vfio_pci_write_config,file=/dev/stdout -device virtio-scsi-pci -device scsi-disk,drive=vd0 -drive if=none,id=vd0,file=w7.qcow2 -no-reboot -no-shutdown
1254@1535049794.246878:vfio_pci_read_config  (0000:01:00.0, @0x3d, len=0x1) 0x1
1254@1535049794.246893:vfio_pci_read_config  (0000:01:00.0, @0x3d, len=0x1) 0x1
1254@1535049794.282017:vfio_pci_read_config  (0000:01:00.0, @0x64, len=0x2) 0x8
1254@1535049794.282028:vfio_pci_read_config  (0000:01:00.0, @0x4, len=0x2) 0x3
1254@1535049794.282031:vfio_pci_write_config  (0000:01:00.0, @0x4, 0x0, len=0x2)
1254@1535049795.329641:vfio_pci_read_config  (0000:01:00.0, @0x3d, len=0x1) 0x1
1254@1535049796.007305:vfio_pci_read_config  (0000:01:00.0, @0x0, len=0x2) 0x10de
1254@1535049796.007332:vfio_pci_read_config  (0000:01:00.0, @0xa, len=0x2) 0x302
1254@1535049796.007377:vfio_pci_read_config  (0000:01:00.0, @0xe, len=0x1) 0x0
1254@1535049796.007843:vfio_pci_read_config  (0000:01:00.0, @0x0, len=0x2) 0x10de
1254@1535049796.007883:vfio_pci_read_config  (0000:01:00.0, @0xa, len=0x2) 0x302
1254@1535049796.007918:vfio_pci_read_config  (0000:01:00.0, @0xe, len=0x1) 0x0
1254@1535049796.013069:vfio_pci_read_config  (0000:01:00.0, @0x0, len=0x2) 0x10de
1254@1535049796.013532:vfio_pci_read_config  (0000:01:00.0, @0x0, len=0x4) 0x1c8d10de
1254@1535049796.013589:vfio_pci_read_config  (0000:01:00.0, @0x8, len=0x4) 0x30200a1
1254@1535049796.013611:vfio_pci_read_config  (0000:01:00.0, @0xe, len=0x1) 0x0
1254@1535049796.013673:vfio_pci_read_config  (0000:01:00.0, @0xe, len=0x1) 0x0
1254@1535049796.022490:vfio_pci_read_config  (0000:01:00.0, @0x10, len=0x4) 0x0
1254@1535049796.022512:vfio_pci_write_config  (0000:01:00.0, @0x10, 0xffffffff, len=0x4)
1254@1535049796.022534:vfio_pci_read_config  (0000:01:00.0, @0x10, len=0x4) 0xff000000
1254@1535049796.022570:vfio_pci_write_config  (0000:01:00.0, @0x10, 0x0, len=0x4)
1254@1535049796.023279:vfio_pci_read_config  (0000:01:00.0, @0x14, len=0x4) 0xc
1254@1535049796.023299:vfio_pci_write_config  (0000:01:00.0, @0x14, 0xffffffff, len=0x4)
1254@1535049796.023320:vfio_pci_read_config  (0000:01:00.0, @0x14, len=0x4) 0xf000000c
1254@1535049796.023356:vfio_pci_write_config  (0000:01:00.0, @0x14, 0xc, len=0x4)
1254@1535049796.023395:vfio_pci_read_config  (0000:01:00.0, @0x18, len=0x4) 0x0
1254@1535049796.023453:vfio_pci_write_config  (0000:01:00.0, @0x18, 0xffffffff, len=0x4)
1254@1535049796.023486:vfio_pci_read_config  (0000:01:00.0, @0x18, len=0x4) 0xffffffff
1254@1535049796.023505:vfio_pci_write_config  (0000:01:00.0, @0x18, 0x0, len=0x4)
1254@1535049796.024111:vfio_pci_read_config  (0000:01:00.0, @0x1c, len=0x4) 0xc
1254@1535049796.024132:vfio_pci_write_config  (0000:01:00.0, @0x1c, 0xffffffff, len=0x4)
1254@1535049796.024183:vfio_pci_read_config  (0000:01:00.0, @0x1c, len=0x4) 0xfe00000c
1254@1535049796.024221:vfio_pci_write_config  (0000:01:00.0, @0x1c, 0xc, len=0x4)
1254@1535049796.024242:vfio_pci_read_config  (0000:01:00.0, @0x20, len=0x4) 0x0
1254@1535049796.024308:vfio_pci_write_config  (0000:01:00.0, @0x20, 0xffffffff, len=0x4)
1254@1535049796.024366:vfio_pci_read_config  (0000:01:00.0, @0x20, len=0x4) 0xffffffff
1254@1535049796.024392:vfio_pci_write_config  (0000:01:00.0, @0x20, 0x0, len=0x4)
1254@1535049796.025237:vfio_pci_read_config  (0000:01:00.0, @0x24, len=0x4) 0x1
1254@1535049796.025281:vfio_pci_write_config  (0000:01:00.0, @0x24, 0xffffffff, len=0x4)
1254@1535049796.025316:vfio_pci_read_config  (0000:01:00.0, @0x24, len=0x4) 0xffffff81
1254@1535049796.025330:vfio_pci_write_config  (0000:01:00.0, @0x24, 0x1, len=0x4)
1254@1535049796.026112:vfio_pci_read_config  (0000:01:00.0, @0x30, len=0x4) 0x0
1254@1535049796.026145:vfio_pci_write_config  (0000:01:00.0, @0x30, 0xfffff800, len=0x4)
1254@1535049796.026166:vfio_pci_read_config  (0000:01:00.0, @0x30, len=0x4) 0x0
1254@1535049796.026215:vfio_pci_write_config  (0000:01:00.0, @0x30, 0x0, len=0x4)
1254@1535049796.041658:vfio_pci_write_config  (0000:01:00.0, @0x24, 0xc000, len=0x4)
1254@1535049796.042378:vfio_pci_write_config  (0000:01:00.0, @0x10, 0xfd000000, len=0x4)
1254@1535049796.043108:vfio_pci_write_config  (0000:01:00.0, @0x14, 0xd0000000, len=0x4)
1254@1535049796.043136:vfio_pci_write_config  (0000:01:00.0, @0x18, 0x0, len=0x4)
1254@1535049796.043872:vfio_pci_write_config  (0000:01:00.0, @0x1c, 0xe0000000, len=0x4)
1254@1535049796.043909:vfio_pci_write_config  (0000:01:00.0, @0x20, 0x0, len=0x4)
1254@1535049796.061571:vfio_pci_read_config  (0000:01:00.0, @0x3d, len=0x1) 0x1
1254@1535049796.061597:vfio_pci_write_config  (0000:01:00.0, @0x3c, 0xa, len=0x1)
1254@1535049796.061687:vfio_pci_read_config  (0000:01:00.0, @0x4, len=0x2) 0x0
1254@1535049796.061710:vfio_pci_write_config  (0000:01:00.0, @0x4, 0x103, len=0x2)
1254@1535049796.544638:vfio_pci_read_config  (0000:01:00.0, @0x30, len=0x4) 0x0
1254@1535049796.544675:vfio_pci_write_config  (0000:01:00.0, @0x30, 0xfffffffe, len=0x4)
1254@1535049796.544709:vfio_pci_read_config  (0000:01:00.0, @0x30, len=0x4) 0x0
1254@1535049796.544739:vfio_pci_write_config  (0000:01:00.0, @0x30, 0x0, len=0x4)
1254@1535049798.599990:vfio_pci_read_config  (0000:01:00.0, @0x2, len=0x2) 0x1c8d
1254@1535049798.600031:vfio_pci_read_config  (0000:01:00.0, @0x0, len=0x4) 0x1c8d10de
1254@1535049798.600048:vfio_pci_read_config  (0000:01:00.0, @0x4, len=0x4) 0x100103
1254@1535049798.600063:vfio_pci_read_config  (0000:01:00.0, @0x8, len=0x4) 0x30200a1
1254@1535049798.600077:vfio_pci_read_config  (0000:01:00.0, @0xc, len=0x4) 0x0
1254@1535049799.370254:vfio_pci_read_config  (0000:01:00.0, @0x0, len=0x4) 0x1c8d10de
1254@1535049799.370295:vfio_pci_read_config  (0000:01:00.0, @0x4, len=0x4) 0x100103
1254@1535049799.370328:vfio_pci_read_config  (0000:01:00.0, @0x8, len=0x4) 0x30200a1
1254@1535049799.370342:vfio_pci_read_config  (0000:01:00.0, @0xc, len=0x4) 0x0
1254@1535049799.370367:vfio_pci_read_config  (0000:01:00.0, @0x10, len=0x4) 0xfd000000
1254@1535049799.370379:vfio_pci_read_config  (0000:01:00.0, @0x14, len=0x4) 0xd000000c
1254@1535049799.370390:vfio_pci_read_config  (0000:01:00.0, @0x18, len=0x4) 0x0
1254@1535049799.370419:vfio_pci_read_config  (0000:01:00.0, @0x1c, len=0x4) 0xe000000c
1254@1535049799.370450:vfio_pci_read_config  (0000:01:00.0, @0x20, len=0x4) 0x0
1254@1535049799.370459:vfio_pci_read_config  (0000:01:00.0, @0x24, len=0x4) 0xc001
1254@1535049799.370474:vfio_pci_read_config  (0000:01:00.0, @0x28, len=0x4) 0x0
1254@1535049799.370499:vfio_pci_read_config  (0000:01:00.0, @0x2c, len=0x4) 0x7be1028
1254@1535049799.370511:vfio_pci_read_config  (0000:01:00.0, @0x30, len=0x4) 0x0
1254@1535049799.370525:vfio_pci_read_config  (0000:01:00.0, @0x34, len=0x4) 0x60
1254@1535049799.370538:vfio_pci_read_config  (0000:01:00.0, @0x38, len=0x4) 0x0
1254@1535049799.370552:vfio_pci_read_config  (0000:01:00.0, @0x3c, len=0x4) 0x10a
1254@1535049799.370566:vfio_pci_read_config  (0000:01:00.0, @0x0, len=0x4) 0x1c8d10de
1254@1535049799.370580:vfio_pci_read_config  (0000:01:00.0, @0x4, len=0x4) 0x100103
1254@1535049799.370593:vfio_pci_read_config  (0000:01:00.0, @0x8, len=0x4) 0x30200a1
1254@1535049799.370608:vfio_pci_read_config  (0000:01:00.0, @0xc, len=0x4) 0x0
1254@1535049799.370638:vfio_pci_read_config  (0000:01:00.0, @0x10, len=0x4) 0xfd000000
1254@1535049799.370651:vfio_pci_read_config  (0000:01:00.0, @0x14, len=0x4) 0xd000000c
1254@1535049799.370661:vfio_pci_read_config  (0000:01:00.0, @0x18, len=0x4) 0x0
1254@1535049799.370682:vfio_pci_read_config  (0000:01:00.0, @0x1c, len=0x4) 0xe000000c
1254@1535049799.370709:vfio_pci_read_config  (0000:01:00.0, @0x20, len=0x4) 0x0
1254@1535049799.370720:vfio_pci_read_config  (0000:01:00.0, @0x24, len=0x4) 0xc001
1254@1535049799.370751:vfio_pci_read_config  (0000:01:00.0, @0x28, len=0x4) 0x0
1254@1535049799.370796:vfio_pci_read_config  (0000:01:00.0, @0x2c, len=0x4) 0x7be1028
1254@1535049799.370806:vfio_pci_read_config  (0000:01:00.0, @0x30, len=0x4) 0x0
1254@1535049799.370816:vfio_pci_read_config  (0000:01:00.0, @0x34, len=0x4) 0x60
1254@1535049799.370839:vfio_pci_read_config  (0000:01:00.0, @0x38, len=0x4) 0x0
1254@1535049799.370849:vfio_pci_read_config  (0000:01:00.0, @0x3c, len=0x4) 0x10a
PG00._ON
NET._PS0
_PS0
PG00._ON
_PS0
1254@1535049799.595378:vfio_pci_read_config  (0000:01:00.0, @0x0, len=0x2) 0x10de
1254@1535049799.595420:vfio_pci_read_config  (0000:01:00.0, @0x0, len=0x2) 0x10de
1254@1535049799.595451:vfio_pci_read_config  (0000:01:00.0, @0x2, len=0x2) 0x1c8d
1254@1535049799.595464:vfio_pci_read_config  (0000:01:00.0, @0x8, len=0x1) 0xa1
1254@1535049799.595489:vfio_pci_read_config  (0000:01:00.0, @0x9, len=0x1) 0x0
1254@1535049799.595520:vfio_pci_read_config  (0000:01:00.0, @0xa, len=0x1) 0x2
1254@1535049799.595532:vfio_pci_read_config  (0000:01:00.0, @0xb, len=0x1) 0x3
1254@1535049799.595556:vfio_pci_read_config  (0000:01:00.0, @0xe, len=0x1) 0x0
1254@1535049799.595584:vfio_pci_read_config  (0000:01:00.0, @0x2c, len=0x2) 0x1028
1254@1535049799.595605:vfio_pci_read_config  (0000:01:00.0, @0x2e, len=0x2) 0x7be
1254@1535049799.595710:vfio_pci_read_config  (0000:01:00.0, @0x6, len=0x2) 0x10
1254@1535049799.595753:vfio_pci_read_config  (0000:01:00.0, @0x34, len=0x1) 0x60
1254@1535049799.595768:vfio_pci_read_config  (0000:01:00.0, @0x60, len=0x2) 0x6801
1254@1535049799.595781:vfio_pci_read_config  (0000:01:00.0, @0x68, len=0x2) 0x7805
1254@1535049799.595804:vfio_pci_read_config  (0000:01:00.0, @0x78, len=0x2) 0x10
1254@1535049799.596048:vfio_pci_read_config  (0000:01:00.0, @0x4, len=0x2) 0x103
1254@1535049799.596064:vfio_pci_read_config  (0000:01:00.0, @0x60, len=0x4) 0x36801
1254@1535049799.596077:vfio_pci_read_config  (0000:01:00.0, @0x64, len=0x4) 0x8
1254@1535049799.596094:vfio_pci_read_config  (0000:01:00.0, @0x6, len=0x2) 0x10
1254@1535049799.596111:vfio_pci_read_config  (0000:01:00.0, @0x4, len=0x2) 0x103
1254@1535049799.596129:vfio_pci_read_config  (0000:01:00.0, @0xc, len=0x1) 0x0
1254@1535049799.596148:vfio_pci_read_config  (0000:01:00.0, @0xd, len=0x1) 0x0
1254@1535049799.596164:vfio_pci_read_config  (0000:01:00.0, @0x3c, len=0x1) 0xa
1254@1535049799.596181:vfio_pci_read_config  (0000:01:00.0, @0x3d, len=0x1) 0x1
1254@1535049799.596197:vfio_pci_read_config  (0000:01:00.0, @0x0, len=0x4) 0x1c8d10de
1254@1535049799.596213:vfio_pci_read_config  (0000:01:00.0, @0x4, len=0x4) 0x100103
1254@1535049799.596229:vfio_pci_read_config  (0000:01:00.0, @0x8, len=0x4) 0x30200a1
1254@1535049799.596245:vfio_pci_read_config  (0000:01:00.0, @0xc, len=0x4) 0x0
1254@1535049799.596259:vfio_pci_read_config  (0000:01:00.0, @0x10, len=0x4) 0xfd000000
1254@1535049799.596273:vfio_pci_read_config  (0000:01:00.0, @0x14, len=0x4) 0xd000000c
1254@1535049799.596287:vfio_pci_read_config  (0000:01:00.0, @0x18, len=0x4) 0x0
1254@1535049799.596300:vfio_pci_read_config  (0000:01:00.0, @0x1c, len=0x4) 0xe000000c
1254@1535049799.596314:vfio_pci_read_config  (0000:01:00.0, @0x20, len=0x4) 0x0
1254@1535049799.596328:vfio_pci_read_config  (0000:01:00.0, @0x24, len=0x4) 0xc001
1254@1535049799.596343:vfio_pci_read_config  (0000:01:00.0, @0x28, len=0x4) 0x0
1254@1535049799.596359:vfio_pci_read_config  (0000:01:00.0, @0x2c, len=0x4) 0x7be1028
1254@1535049799.596376:vfio_pci_read_config  (0000:01:00.0, @0x30, len=0x4) 0x0
1254@1535049799.596392:vfio_pci_read_config  (0000:01:00.0, @0x34, len=0x4) 0x60
1254@1535049799.596408:vfio_pci_read_config  (0000:01:00.0, @0x38, len=0x4) 0x0
1254@1535049799.596423:vfio_pci_read_config  (0000:01:00.0, @0x3c, len=0x4) 0x10a
1254@1535049799.596466:vfio_pci_read_config  (0000:01:00.0, @0x7a, len=0x2) 0x2
1254@1535049799.596486:vfio_pci_read_config  (0000:01:00.0, @0x80, len=0x2) 0x2930
1254@1535049799.596506:vfio_pci_read_config  (0000:01:00.0, @0x7c, len=0x4) 0x12c8de1
1254@1535049799.596524:vfio_pci_read_config  (0000:01:00.0, @0x84, len=0x4) 0x454d03
1254@1535049799.596542:vfio_pci_read_config  (0000:01:00.0, @0x88, len=0x2) 0x40
1254@1535049799.596559:vfio_pci_read_config  (0000:01:00.0, @0x8a, len=0x2) 0x1103
1254@1535049799.596575:vfio_pci_read_config  (0000:01:00.0, @0x100, len=0x4) 0x25010002
1254@1535049799.596592:vfio_pci_read_config  (0000:01:00.0, @0x250, len=0x4) 0x12810018
1254@1535049799.596607:vfio_pci_read_config  (0000:01:00.0, @0x128, len=0x4) 0x42010004
1254@1535049799.596622:vfio_pci_read_config  (0000:01:00.0, @0x420, len=0x4) 0x60020001
1254@1535049799.596638:vfio_pci_read_config  (0000:01:00.0, @0x600, len=0x4) 0x1000b
1254@1535049799.596699:vfio_pci_write_config  (0000:01:00.0, @0x424, 0xffffffff, len=0x4)
1254@1535049799.596716:vfio_pci_write_config  (0000:01:00.0, @0x428, 0x0, len=0x4)
1254@1535049799.596736:vfio_pci_write_config  (0000:01:00.0, @0x42c, 0x62011, len=0x4)
1254@1535049799.596754:vfio_pci_write_config  (0000:01:00.0, @0x430, 0xffffffff, len=0x4)
1254@1535049799.596773:vfio_pci_write_config  (0000:01:00.0, @0x434, 0x0, len=0x4)
1254@1535049799.596790:vfio_pci_write_config  (0000:01:00.0, @0x438, 0x0, len=0x4)
1254@1535049799.596807:vfio_pci_read_config  (0000:01:00.0, @0x420, len=0x4) 0x60020001
1254@1535049799.596823:vfio_pci_read_config  (0000:01:00.0, @0x424, len=0x4) 0x0
1254@1535049799.596842:vfio_pci_read_config  (0000:01:00.0, @0x428, len=0x4) 0x0
1254@1535049799.596858:vfio_pci_read_config  (0000:01:00.0, @0x42c, len=0x4) 0x462030
1254@1535049799.596873:vfio_pci_read_config  (0000:01:00.0, @0x430, len=0x4) 0x0
1254@1535049799.596888:vfio_pci_read_config  (0000:01:00.0, @0x434, len=0x4) 0x0
1254@1535049799.596902:vfio_pci_read_config  (0000:01:00.0, @0x438, len=0x4) 0x0
1254@1535049799.596916:vfio_pci_read_config  (0000:01:00.0, @0x43c, len=0x4) 0x0
1254@1535049799.596932:vfio_pci_read_config  (0000:01:00.0, @0x440, len=0x4) 0x0
1254@1535049799.596948:vfio_pci_read_config  (0000:01:00.0, @0x444, len=0x4) 0x0
1254@1535049799.596963:vfio_pci_read_config  (0000:01:00.0, @0x448, len=0x4) 0x0
1254@1535049799.596979:vfio_pci_write_config  (0000:01:00.0, @0x82, 0xf, len=0x2)
1254@1535049799.597000:vfio_pci_read_config  (0000:01:00.0, @0x64, len=0x2) 0x8
1254@1535049799.597019:vfio_pci_read_config  (0000:01:00.0, @0x4, len=0x2) 0x103
1254@1535049799.597035:vfio_pci_write_config  (0000:01:00.0, @0x4, 0x500, len=0x2)
1254@1535049799.600000:vfio_pci_read_config  (0000:01:00.0, @0x10, len=0x4) 0xfd000000
1254@1535049799.600021:vfio_pci_read_config  (0000:01:00.0, @0x14, len=0x4) 0xd000000c
1254@1535049799.600031:vfio_pci_read_config  (0000:01:00.0, @0x18, len=0x4) 0x0
1254@1535049799.600041:vfio_pci_read_config  (0000:01:00.0, @0x1c, len=0x4) 0xe000000c
1254@1535049799.600061:vfio_pci_read_config  (0000:01:00.0, @0x20, len=0x4) 0x0
1254@1535049799.600076:vfio_pci_read_config  (0000:01:00.0, @0x24, len=0x4) 0xc001
1254@1535049799.600093:vfio_pci_write_config  (0000:01:00.0, @0x10, 0xffffffff, len=0x4)
1254@1535049799.600130:vfio_pci_write_config  (0000:01:00.0, @0x14, 0xffffffff, len=0x4)
1254@1535049799.600147:vfio_pci_write_config  (0000:01:00.0, @0x18, 0xffffffff, len=0x4)
1254@1535049799.600162:vfio_pci_write_config  (0000:01:00.0, @0x1c, 0xffffffff, len=0x4)
1254@1535049799.600208:vfio_pci_write_config  (0000:01:00.0, @0x20, 0xffffffff, len=0x4)
1254@1535049799.600231:vfio_pci_write_config  (0000:01:00.0, @0x24, 0xffffffff, len=0x4)
1254@1535049799.600265:vfio_pci_read_config  (0000:01:00.0, @0x10, len=0x4) 0xff000000
1254@1535049799.600414:vfio_pci_read_config  (0000:01:00.0, @0x14, len=0x4) 0xf000000c
1254@1535049799.600470:vfio_pci_read_config  (0000:01:00.0, @0x18, len=0x4) 0xffffffff
1254@1535049799.600486:vfio_pci_read_config  (0000:01:00.0, @0x1c, len=0x4) 0xfe00000c
1254@1535049799.600496:vfio_pci_read_config  (0000:01:00.0, @0x20, len=0x4) 0xffffffff
1254@1535049799.600509:vfio_pci_read_config  (0000:01:00.0, @0x24, len=0x4) 0xffffff81
1254@1535049799.600524:vfio_pci_write_config  (0000:01:00.0, @0x10, 0xfd000000, len=0x4)
1254@1535049799.600542:vfio_pci_write_config  (0000:01:00.0, @0x14, 0xd000000c, len=0x4)
1254@1535049799.600557:vfio_pci_write_config  (0000:01:00.0, @0x18, 0x0, len=0x4)
1254@1535049799.600573:vfio_pci_write_config  (0000:01:00.0, @0x1c, 0xe000000c, len=0x4)
1254@1535049799.600588:vfio_pci_write_config  (0000:01:00.0, @0x20, 0x0, len=0x4)
1254@1535049799.600604:vfio_pci_write_config  (0000:01:00.0, @0x24, 0xc001, len=0x4)
1254@1535049799.600621:vfio_pci_read_config  (0000:01:00.0, @0x30, len=0x4) 0x0
1254@1535049799.600638:vfio_pci_write_config  (0000:01:00.0, @0x30, 0xffffffff, len=0x4)
1254@1535049799.600655:vfio_pci_read_config  (0000:01:00.0, @0x30, len=0x4) 0x0
1254@1535049799.600671:vfio_pci_write_config  (0000:01:00.0, @0x30, 0x0, len=0x4)
1254@1535049799.600694:vfio_pci_write_config  (0000:01:00.0, @0x4, 0x103, len=0x2)
1254@1535049799.613120:vfio_pci_read_config  (0000:01:00.0, @0x6a, len=0x2) 0x80
1254@1535049799.613219:vfio_pci_read_config  (0000:01:00.0, @0x6a, len=0x2) 0x80
1254@1535049799.613251:vfio_pci_write_config  (0000:01:00.0, @0x6a, 0x80, len=0x2)
1254@1535049799.613311:vfio_pci_read_config  (0000:01:00.0, @0x4, len=0x2) 0x103
1254@1535049799.613324:vfio_pci_read_config  (0000:01:00.0, @0x10, len=0x4) 0xfd000000
1254@1535049799.613334:vfio_pci_read_config  (0000:01:00.0, @0x14, len=0x4) 0xd000000c
1254@1535049799.613375:vfio_pci_read_config  (0000:01:00.0, @0x18, len=0x4) 0x0
1254@1535049799.613388:vfio_pci_read_config  (0000:01:00.0, @0x1c, len=0x4) 0xe000000c
1254@1535049799.613400:vfio_pci_read_config  (0000:01:00.0, @0x20, len=0x4) 0x0
1254@1535049799.613425:vfio_pci_read_config  (0000:01:00.0, @0x24, len=0x4) 0xc001
1254@1535049799.613458:vfio_pci_read_config  (0000:01:00.0, @0x30, len=0x4) 0x0
1254@1535049799.614172:vfio_pci_write_config  (0000:01:00.0, @0x88, 0x40, len=0x2)
1254@1535049799.614652:vfio_pci_read_config  (0000:01:00.0, @0x0, len=0x4) 0x1c8d10de
1254@1535049799.614685:vfio_pci_read_config  (0000:01:00.0, @0x4, len=0x4) 0x100103
1254@1535049799.614697:vfio_pci_read_config  (0000:01:00.0, @0x8, len=0x4) 0x30200a1
1254@1535049799.614708:vfio_pci_read_config  (0000:01:00.0, @0xc, len=0x4) 0x0
1254@1535049799.614734:vfio_pci_read_config  (0000:01:00.0, @0x10, len=0x4) 0xfd000000
1254@1535049799.614761:vfio_pci_read_config  (0000:01:00.0, @0x14, len=0x4) 0xd000000c
1254@1535049799.614771:vfio_pci_read_config  (0000:01:00.0, @0x18, len=0x4) 0x0
1254@1535049799.614780:vfio_pci_read_config  (0000:01:00.0, @0x1c, len=0x4) 0xe000000c
1254@1535049799.614788:vfio_pci_read_config  (0000:01:00.0, @0x20, len=0x4) 0x0
1254@1535049799.614796:vfio_pci_read_config  (0000:01:00.0, @0x24, len=0x4) 0xc001
1254@1535049799.614831:vfio_pci_read_config  (0000:01:00.0, @0x28, len=0x4) 0x0
1254@1535049799.614840:vfio_pci_read_config  (0000:01:00.0, @0x2c, len=0x4) 0x7be1028
1254@1535049799.614853:vfio_pci_read_config  (0000:01:00.0, @0x30, len=0x4) 0x0
1254@1535049799.614881:vfio_pci_read_config  (0000:01:00.0, @0x34, len=0x4) 0x60
1254@1535049799.614897:vfio_pci_read_config  (0000:01:00.0, @0x38, len=0x4) 0x0
1254@1535049799.614931:vfio_pci_read_config  (0000:01:00.0, @0x3c, len=0x4) 0x10a
1254@1535049799.615077:vfio_pci_read_config  (0000:01:00.0, @0x0, len=0x4) 0x1c8d10de
1254@1535049799.615095:vfio_pci_read_config  (0000:01:00.0, @0x4, len=0x4) 0x100103
1254@1535049799.615123:vfio_pci_read_config  (0000:01:00.0, @0x8, len=0x4) 0x30200a1
1254@1535049799.615139:vfio_pci_read_config  (0000:01:00.0, @0xc, len=0x4) 0x0
1254@1535049799.615152:vfio_pci_read_config  (0000:01:00.0, @0x10, len=0x4) 0xfd000000
1254@1535049799.615166:vfio_pci_read_config  (0000:01:00.0, @0x14, len=0x4) 0xd000000c
1254@1535049799.615192:vfio_pci_read_config  (0000:01:00.0, @0x18, len=0x4) 0x0
1254@1535049799.615237:vfio_pci_read_config  (0000:01:00.0, @0x1c, len=0x4) 0xe000000c
1254@1535049799.615251:vfio_pci_read_config  (0000:01:00.0, @0x20, len=0x4) 0x0
1254@1535049799.615276:vfio_pci_read_config  (0000:01:00.0, @0x24, len=0x4) 0xc001
1254@1535049799.615317:vfio_pci_read_config  (0000:01:00.0, @0x28, len=0x4) 0x0
1254@1535049799.615348:vfio_pci_read_config  (0000:01:00.0, @0x2c, len=0x4) 0x7be1028
1254@1535049799.615361:vfio_pci_read_config  (0000:01:00.0, @0x30, len=0x4) 0x0
1254@1535049799.615403:vfio_pci_read_config  (0000:01:00.0, @0x34, len=0x4) 0x60
1254@1535049799.615419:vfio_pci_read_config  (0000:01:00.0, @0x38, len=0x4) 0x0
1254@1535049799.615435:vfio_pci_read_config  (0000:01:00.0, @0x3c, len=0x4) 0x10a
_DSM
0xD0,0x37,0xC9,0xE5,0x53,0x35,0x7A,0x4D,0x91,0x17,0xEA,0x4D,0x19,0xC3,0x43,0x4D
0x1
0x0
1254@1535049799.617352:vfio_pci_read_config  (0000:01:00.0, @0x0, len=0x2) 0x10de
1254@1535049799.617370:vfio_pci_read_config  (0000:01:00.0, @0x2, len=0x2) 0x1c8d
1254@1535049799.617384:vfio_pci_read_config  (0000:01:00.0, @0x8, len=0x1) 0xa1
1254@1535049799.617401:vfio_pci_read_config  (0000:01:00.0, @0x9, len=0x1) 0x0
1254@1535049799.617418:vfio_pci_read_config  (0000:01:00.0, @0xa, len=0x1) 0x2
1254@1535049799.617436:vfio_pci_read_config  (0000:01:00.0, @0xb, len=0x1) 0x3
1254@1535049799.617453:vfio_pci_read_config  (0000:01:00.0, @0xe, len=0x1) 0x0
1254@1535049799.617469:vfio_pci_read_config  (0000:01:00.0, @0x2c, len=0x2) 0x1028
1254@1535049799.617485:vfio_pci_read_config  (0000:01:00.0, @0x2e, len=0x2) 0x7be
1254@1535049799.617503:vfio_pci_read_config  (0000:01:00.0, @0x4, len=0x2) 0x103
1254@1535049799.617518:vfio_pci_read_config  (0000:01:00.0, @0x10, len=0x4) 0xfd000000
1254@1535049799.617533:vfio_pci_read_config  (0000:01:00.0, @0x14, len=0x4) 0xd000000c
1254@1535049799.617547:vfio_pci_read_config  (0000:01:00.0, @0x18, len=0x4) 0x0
1254@1535049799.617561:vfio_pci_read_config  (0000:01:00.0, @0x1c, len=0x4) 0xe000000c
1254@1535049799.617576:vfio_pci_read_config  (0000:01:00.0, @0x20, len=0x4) 0x0
1254@1535049799.617590:vfio_pci_read_config  (0000:01:00.0, @0x24, len=0x4) 0xc001
1254@1535049799.617606:vfio_pci_read_config  (0000:01:00.0, @0x30, len=0x4) 0x0
1254@1535049799.617625:vfio_pci_read_config  (0000:01:00.0, @0x4, len=0x2) 0x103
1254@1535049804.050979:vfio_pci_read_config  (0000:01:00.0, @0x0, len=0x4) 0x1c8d10de
1254@1535049804.051022:vfio_pci_read_config  (0000:01:00.0, @0x4, len=0x4) 0x100103
1254@1535049804.051037:vfio_pci_read_config  (0000:01:00.0, @0x8, len=0x4) 0x30200a1
1254@1535049804.051050:vfio_pci_read_config  (0000:01:00.0, @0xc, len=0x4) 0x0
1254@1535049804.051061:vfio_pci_read_config  (0000:01:00.0, @0x10, len=0x4) 0xfd000000
1254@1535049804.051072:vfio_pci_read_config  (0000:01:00.0, @0x14, len=0x4) 0xd000000c
1254@1535049804.051084:vfio_pci_read_config  (0000:01:00.0, @0x18, len=0x4) 0x0
1254@1535049804.051113:vfio_pci_read_config  (0000:01:00.0, @0x1c, len=0x4) 0xe000000c
1254@1535049804.051123:vfio_pci_read_config  (0000:01:00.0, @0x20, len=0x4) 0x0
1254@1535049804.051132:vfio_pci_read_config  (0000:01:00.0, @0x24, len=0x4) 0xc001
1254@1535049804.051143:vfio_pci_read_config  (0000:01:00.0, @0x28, len=0x4) 0x0
1254@1535049804.051152:vfio_pci_read_config  (0000:01:00.0, @0x2c, len=0x4) 0x7be1028
1254@1535049804.051162:vfio_pci_read_config  (0000:01:00.0, @0x30, len=0x4) 0x0
1254@1535049804.051191:vfio_pci_read_config  (0000:01:00.0, @0x34, len=0x4) 0x60
1254@1535049804.051202:vfio_pci_read_config  (0000:01:00.0, @0x38, len=0x4) 0x0
1254@1535049804.051213:vfio_pci_read_config  (0000:01:00.0, @0x3c, len=0x4) 0x10a
1254@1535049804.051237:vfio_pci_read_config  (0000:01:00.0, @0x40, len=0x4) 0x0
1254@1535049804.051269:vfio_pci_read_config  (0000:01:00.0, @0x44, len=0x4) 0x0
1254@1535049804.051282:vfio_pci_read_config  (0000:01:00.0, @0x48, len=0x4) 0x0
1254@1535049804.051309:vfio_pci_read_config  (0000:01:00.0, @0x4c, len=0x4) 0x0
1254@1535049804.051341:vfio_pci_read_config  (0000:01:00.0, @0x50, len=0x4) 0x0
1254@1535049804.051355:vfio_pci_read_config  (0000:01:00.0, @0x54, len=0x4) 0x1
1254@1535049804.051369:vfio_pci_read_config  (0000:01:00.0, @0x58, len=0x4) 0x23d6ce
1254@1535049804.051394:vfio_pci_read_config  (0000:01:00.0, @0x5c, len=0x4) 0x0
1254@1535049804.051427:vfio_pci_read_config  (0000:01:00.0, @0x60, len=0x4) 0x36801
1254@1535049804.051440:vfio_pci_read_config  (0000:01:00.0, @0x64, len=0x4) 0x8
1254@1535049804.051465:vfio_pci_read_config  (0000:01:00.0, @0x68, len=0x4) 0x807805
1254@1535049804.051495:vfio_pci_read_config  (0000:01:00.0, @0x6c, len=0x4) 0x0
1254@1535049804.051506:vfio_pci_read_config  (0000:01:00.0, @0x70, len=0x4) 0x0
1254@1535049804.051520:vfio_pci_read_config  (0000:01:00.0, @0x74, len=0x4) 0x0
1254@1535049804.051546:vfio_pci_read_config  (0000:01:00.0, @0x78, len=0x4) 0x20010
1254@1535049804.051557:vfio_pci_read_config  (0000:01:00.0, @0x7c, len=0x4) 0x12c8de1
1254@1535049804.051570:vfio_pci_read_config  (0000:01:00.0, @0x80, len=0x4) 0x2930
1254@1535049804.051584:vfio_pci_read_config  (0000:01:00.0, @0x84, len=0x4) 0x454d03
1254@1535049804.051597:vfio_pci_read_config  (0000:01:00.0, @0x88, len=0x4) 0x11030040
1254@1535049804.051610:vfio_pci_read_config  (0000:01:00.0, @0x8c, len=0x4) 0x0
1254@1535049804.051642:vfio_pci_read_config  (0000:01:00.0, @0x90, len=0x4) 0x0
1254@1535049804.051657:vfio_pci_read_config  (0000:01:00.0, @0x94, len=0x4) 0x0
1254@1535049804.051671:vfio_pci_read_config  (0000:01:00.0, @0x98, len=0x4) 0x0
1254@1535049804.051684:vfio_pci_read_config  (0000:01:00.0, @0x9c, len=0x4) 0x40813
1254@1535049804.051699:vfio_pci_read_config  (0000:01:00.0, @0xa0, len=0x4) 0x400
1254@1535049804.051713:vfio_pci_read_config  (0000:01:00.0, @0xa4, len=0x4) 0xe
1254@1535049804.051764:vfio_pci_read_config  (0000:01:00.0, @0xa8, len=0x4) 0x1f0003
1254@1535049804.051778:vfio_pci_read_config  (0000:01:00.0, @0xac, len=0x4) 0x0
1254@1535049804.051793:vfio_pci_read_config  (0000:01:00.0, @0xb0, len=0x4) 0x0
1254@1535049804.051836:vfio_pci_read_config  (0000:01:00.0, @0xb4, len=0x4) 0x1140009
1254@1535049804.051851:vfio_pci_read_config  (0000:01:00.0, @0xb8, len=0x4) 0x0
1254@1535049804.051865:vfio_pci_read_config  (0000:01:00.0, @0xbc, len=0x4) 0x0
1254@1535049804.051891:vfio_pci_read_config  (0000:01:00.0, @0xc0, len=0x4) 0x0
1254@1535049804.051923:vfio_pci_read_config  (0000:01:00.0, @0xc4, len=0x4) 0x0
1254@1535049804.051937:vfio_pci_read_config  (0000:01:00.0, @0xc8, len=0x4) 0x0
1254@1535049804.051963:vfio_pci_read_config  (0000:01:00.0, @0xcc, len=0x4) 0x0
1254@1535049804.051994:vfio_pci_read_config  (0000:01:00.0, @0xd0, len=0x4) 0x0
1254@1535049804.052008:vfio_pci_read_config  (0000:01:00.0, @0xd4, len=0x4) 0x0
1254@1535049804.052022:vfio_pci_read_config  (0000:01:00.0, @0xd8, len=0x4) 0x0
1254@1535049804.052048:vfio_pci_read_config  (0000:01:00.0, @0xdc, len=0x4) 0x0
1254@1535049804.052074:vfio_pci_read_config  (0000:01:00.0, @0xe0, len=0x4) 0x0
1254@1535049804.052088:vfio_pci_read_config  (0000:01:00.0, @0xe4, len=0x4) 0x0
1254@1535049804.052114:vfio_pci_read_config  (0000:01:00.0, @0xe8, len=0x4) 0x0
1254@1535049804.052142:vfio_pci_read_config  (0000:01:00.0, @0xec, len=0x4) 0x0
1254@1535049804.052156:vfio_pci_read_config  (0000:01:00.0, @0xf0, len=0x4) 0x0
1254@1535049804.052170:vfio_pci_read_config  (0000:01:00.0, @0xf4, len=0x4) 0x0
1254@1535049804.052184:vfio_pci_read_config  (0000:01:00.0, @0xf8, len=0x4) 0x0
1254@1535049804.052197:vfio_pci_read_config  (0000:01:00.0, @0xfc, len=0x4) 0x0
1254@1535049804.096696:vfio_pci_read_config  (0000:01:00.0, @0x0, len=0x4) 0x1c8d10de
1254@1535049804.096744:vfio_pci_read_config  (0000:01:00.0, @0x4, len=0x4) 0x100103
1254@1535049804.096779:vfio_pci_read_config  (0000:01:00.0, @0x8, len=0x4) 0x30200a1
1254@1535049804.096806:vfio_pci_read_config  (0000:01:00.0, @0xc, len=0x4) 0x0
1254@1535049804.096817:vfio_pci_read_config  (0000:01:00.0, @0x10, len=0x4) 0xfd000000
1254@1535049804.096829:vfio_pci_read_config  (0000:01:00.0, @0x14, len=0x4) 0xd000000c
1254@1535049804.096839:vfio_pci_read_config  (0000:01:00.0, @0x18, len=0x4) 0x0
1254@1535049804.096851:vfio_pci_read_config  (0000:01:00.0, @0x1c, len=0x4) 0xe000000c
1254@1535049804.096860:vfio_pci_read_config  (0000:01:00.0, @0x20, len=0x4) 0x0
1254@1535049804.096870:vfio_pci_read_config  (0000:01:00.0, @0x24, len=0x4) 0xc001
1254@1535049804.096881:vfio_pci_read_config  (0000:01:00.0, @0x28, len=0x4) 0x0
1254@1535049804.096893:vfio_pci_read_config  (0000:01:00.0, @0x2c, len=0x4) 0x7be1028
1254@1535049804.096921:vfio_pci_read_config  (0000:01:00.0, @0x30, len=0x4) 0x0
1254@1535049804.096932:vfio_pci_read_config  (0000:01:00.0, @0x34, len=0x4) 0x60
1254@1535049804.096943:vfio_pci_read_config  (0000:01:00.0, @0x38, len=0x4) 0x0
1254@1535049804.096967:vfio_pci_read_config  (0000:01:00.0, @0x3c, len=0x4) 0x10a
1254@1535049804.096999:vfio_pci_read_config  (0000:01:00.0, @0x40, len=0x4) 0x0
1254@1535049804.097011:vfio_pci_read_config  (0000:01:00.0, @0x44, len=0x4) 0x0
1254@1535049804.097036:vfio_pci_read_config  (0000:01:00.0, @0x48, len=0x4) 0x0
1254@1535049804.097066:vfio_pci_read_config  (0000:01:00.0, @0x4c, len=0x4) 0x0
1254@1535049804.097079:vfio_pci_read_config  (0000:01:00.0, @0x50, len=0x4) 0x0
1254@1535049804.097090:vfio_pci_read_config  (0000:01:00.0, @0x54, len=0x4) 0x1
1254@1535049804.097101:vfio_pci_read_config  (0000:01:00.0, @0x58, len=0x4) 0x23d6ce
1254@1535049804.097147:vfio_pci_read_config  (0000:01:00.0, @0x5c, len=0x4) 0x0
1254@1535049804.097162:vfio_pci_read_config  (0000:01:00.0, @0x60, len=0x4) 0x36801
1254@1535049804.097189:vfio_pci_read_config  (0000:01:00.0, @0x64, len=0x4) 0x8
1254@1535049804.097219:vfio_pci_read_config  (0000:01:00.0, @0x68, len=0x4) 0x807805
1254@1535049804.097231:vfio_pci_read_config  (0000:01:00.0, @0x6c, len=0x4) 0x0
1254@1535049804.097255:vfio_pci_read_config  (0000:01:00.0, @0x70, len=0x4) 0x0
1254@1535049804.097288:vfio_pci_read_config  (0000:01:00.0, @0x74, len=0x4) 0x0
1254@1535049804.097303:vfio_pci_read_config  (0000:01:00.0, @0x78, len=0x4) 0x20010
1254@1535049804.097329:vfio_pci_read_config  (0000:01:00.0, @0x7c, len=0x4) 0x12c8de1
1254@1535049804.097363:vfio_pci_read_config  (0000:01:00.0, @0x80, len=0x4) 0x2930
1254@1535049804.097376:vfio_pci_read_config  (0000:01:00.0, @0x84, len=0x4) 0x454d03
1254@1535049804.097420:vfio_pci_read_config  (0000:01:00.0, @0x88, len=0x4) 0x11030040
1254@1535049804.097434:vfio_pci_read_config  (0000:01:00.0, @0x8c, len=0x4) 0x0
1254@1535049804.097447:vfio_pci_read_config  (0000:01:00.0, @0x90, len=0x4) 0x0
1254@1535049804.097460:vfio_pci_read_config  (0000:01:00.0, @0x94, len=0x4) 0x0
1254@1535049804.097474:vfio_pci_read_config  (0000:01:00.0, @0x98, len=0x4) 0x0
1254@1535049804.097487:vfio_pci_read_config  (0000:01:00.0, @0x9c, len=0x4) 0x40813
1254@1535049804.097532:vfio_pci_read_config  (0000:01:00.0, @0xa0, len=0x4) 0x400
1254@1535049804.097546:vfio_pci_read_config  (0000:01:00.0, @0xa4, len=0x4) 0xe
1254@1535049804.097560:vfio_pci_read_config  (0000:01:00.0, @0xa8, len=0x4) 0x1f0003
1254@1535049804.097586:vfio_pci_read_config  (0000:01:00.0, @0xac, len=0x4) 0x0
1254@1535049804.097613:vfio_pci_read_config  (0000:01:00.0, @0xb0, len=0x4) 0x0
1254@1535049804.097627:vfio_pci_read_config  (0000:01:00.0, @0xb4, len=0x4) 0x1140009
1254@1535049804.097641:vfio_pci_read_config  (0000:01:00.0, @0xb8, len=0x4) 0x0
1254@1535049804.097655:vfio_pci_read_config  (0000:01:00.0, @0xbc, len=0x4) 0x0
1254@1535049804.097669:vfio_pci_read_config  (0000:01:00.0, @0xc0, len=0x4) 0x0
1254@1535049804.097683:vfio_pci_read_config  (0000:01:00.0, @0xc4, len=0x4) 0x0
1254@1535049804.097697:vfio_pci_read_config  (0000:01:00.0, @0xc8, len=0x4) 0x0
1254@1535049804.097710:vfio_pci_read_config  (0000:01:00.0, @0xcc, len=0x4) 0x0
1254@1535049804.097726:vfio_pci_read_config  (0000:01:00.0, @0xd0, len=0x4) 0x0
1254@1535049804.097834:vfio_pci_read_config  (0000:01:00.0, @0xd4, len=0x4) 0x0
1254@1535049804.097847:vfio_pci_read_config  (0000:01:00.0, @0xd8, len=0x4) 0x0
1254@1535049804.097873:vfio_pci_read_config  (0000:01:00.0, @0xdc, len=0x4) 0x0
1254@1535049804.097886:vfio_pci_read_config  (0000:01:00.0, @0xe0, len=0x4) 0x0
1254@1535049804.097897:vfio_pci_read_config  (0000:01:00.0, @0xe4, len=0x4) 0x0
1254@1535049804.097923:vfio_pci_read_config  (0000:01:00.0, @0xe8, len=0x4) 0x0
1254@1535049804.097934:vfio_pci_read_config  (0000:01:00.0, @0xec, len=0x4) 0x0
1254@1535049804.097945:vfio_pci_read_config  (0000:01:00.0, @0xf0, len=0x4) 0x0
1254@1535049804.097956:vfio_pci_read_config  (0000:01:00.0, @0xf4, len=0x4) 0x0
1254@1535049804.097968:vfio_pci_read_config  (0000:01:00.0, @0xf8, len=0x4) 0x0
1254@1535049804.097979:vfio_pci_read_config  (0000:01:00.0, @0xfc, len=0x4) 0x0
1254@1535049804.098119:vfio_pci_read_config  (0000:01:00.0, @0x0, len=0x4) 0x1c8d10de
1254@1535049804.098133:vfio_pci_read_config  (0000:01:00.0, @0x4, len=0x4) 0x100103
1254@1535049804.098144:vfio_pci_read_config  (0000:01:00.0, @0x8, len=0x4) 0x30200a1
1254@1535049804.098156:vfio_pci_read_config  (0000:01:00.0, @0xc, len=0x4) 0x0
1254@1535049804.098168:vfio_pci_read_config  (0000:01:00.0, @0x10, len=0x4) 0xfd000000
1254@1535049804.098180:vfio_pci_read_config  (0000:01:00.0, @0x14, len=0x4) 0xd000000c
1254@1535049804.098192:vfio_pci_read_config  (0000:01:00.0, @0x18, len=0x4) 0x0
1254@1535049804.098205:vfio_pci_read_config  (0000:01:00.0, @0x1c, len=0x4) 0xe000000c
1254@1535049804.098218:vfio_pci_read_config  (0000:01:00.0, @0x20, len=0x4) 0x0
1254@1535049804.098230:vfio_pci_read_config  (0000:01:00.0, @0x24, len=0x4) 0xc001
1254@1535049804.098244:vfio_pci_read_config  (0000:01:00.0, @0x28, len=0x4) 0x0
1254@1535049804.098257:vfio_pci_read_config  (0000:01:00.0, @0x2c, len=0x4) 0x7be1028
1254@1535049804.098269:vfio_pci_read_config  (0000:01:00.0, @0x30, len=0x4) 0x0
1254@1535049804.098283:vfio_pci_read_config  (0000:01:00.0, @0x34, len=0x4) 0x60
1254@1535049804.098298:vfio_pci_read_config  (0000:01:00.0, @0x38, len=0x4) 0x0
1254@1535049804.098313:vfio_pci_read_config  (0000:01:00.0, @0x3c, len=0x4) 0x10a
1254@1535049804.098327:vfio_pci_read_config  (0000:01:00.0, @0x40, len=0x4) 0x0
1254@1535049804.098343:vfio_pci_read_config  (0000:01:00.0, @0x44, len=0x4) 0x0
1254@1535049804.098357:vfio_pci_read_config  (0000:01:00.0, @0x48, len=0x4) 0x0
1254@1535049804.098372:vfio_pci_read_config  (0000:01:00.0, @0x4c, len=0x4) 0x0
1254@1535049804.098385:vfio_pci_read_config  (0000:01:00.0, @0x50, len=0x4) 0x0
1254@1535049804.098400:vfio_pci_read_config  (0000:01:00.0, @0x54, len=0x4) 0x1
1254@1535049804.098412:vfio_pci_read_config  (0000:01:00.0, @0x58, len=0x4) 0x23d6ce
1254@1535049804.098426:vfio_pci_read_config  (0000:01:00.0, @0x5c, len=0x4) 0x0
1254@1535049804.098440:vfio_pci_read_config  (0000:01:00.0, @0x60, len=0x4) 0x36801
1254@1535049804.098454:vfio_pci_read_config  (0000:01:00.0, @0x64, len=0x4) 0x8
1254@1535049804.098466:vfio_pci_read_config  (0000:01:00.0, @0x68, len=0x4) 0x807805
1254@1535049804.098479:vfio_pci_read_config  (0000:01:00.0, @0x6c, len=0x4) 0x0
1254@1535049804.098491:vfio_pci_read_config  (0000:01:00.0, @0x70, len=0x4) 0x0
1254@1535049804.098505:vfio_pci_read_config  (0000:01:00.0, @0x74, len=0x4) 0x0
1254@1535049804.098519:vfio_pci_read_config  (0000:01:00.0, @0x78, len=0x4) 0x20010
1254@1535049804.098533:vfio_pci_read_config  (0000:01:00.0, @0x7c, len=0x4) 0x12c8de1
1254@1535049804.098548:vfio_pci_read_config  (0000:01:00.0, @0x80, len=0x4) 0x2930
1254@1535049804.098562:vfio_pci_read_config  (0000:01:00.0, @0x84, len=0x4) 0x454d03
1254@1535049804.098576:vfio_pci_read_config  (0000:01:00.0, @0x88, len=0x4) 0x11030040
1254@1535049804.098590:vfio_pci_read_config  (0000:01:00.0, @0x8c, len=0x4) 0x0
1254@1535049804.098604:vfio_pci_read_config  (0000:01:00.0, @0x90, len=0x4) 0x0
1254@1535049804.098618:vfio_pci_read_config  (0000:01:00.0, @0x94, len=0x4) 0x0
1254@1535049804.098633:vfio_pci_read_config  (0000:01:00.0, @0x98, len=0x4) 0x0
1254@1535049804.098647:vfio_pci_read_config  (0000:01:00.0, @0x9c, len=0x4) 0x40813
1254@1535049804.098661:vfio_pci_read_config  (0000:01:00.0, @0xa0, len=0x4) 0x400
1254@1535049804.098675:vfio_pci_read_config  (0000:01:00.0, @0xa4, len=0x4) 0xe
1254@1535049804.098689:vfio_pci_read_config  (0000:01:00.0, @0xa8, len=0x4) 0x1f0003
1254@1535049804.098705:vfio_pci_read_config  (0000:01:00.0, @0xac, len=0x4) 0x0
1254@1535049804.098720:vfio_pci_read_config  (0000:01:00.0, @0xb0, len=0x4) 0x0
1254@1535049804.098738:vfio_pci_read_config  (0000:01:00.0, @0xb4, len=0x4) 0x1140009
1254@1535049804.098755:vfio_pci_read_config  (0000:01:00.0, @0xb8, len=0x4) 0x0
1254@1535049804.098769:vfio_pci_read_config  (0000:01:00.0, @0xbc, len=0x4) 0x0
1254@1535049804.098782:vfio_pci_read_config  (0000:01:00.0, @0xc0, len=0x4) 0x0
1254@1535049804.098796:vfio_pci_read_config  (0000:01:00.0, @0xc4, len=0x4) 0x0
1254@1535049804.098810:vfio_pci_read_config  (0000:01:00.0, @0xc8, len=0x4) 0x0
1254@1535049804.098824:vfio_pci_read_config  (0000:01:00.0, @0xcc, len=0x4) 0x0
1254@1535049804.098837:vfio_pci_read_config  (0000:01:00.0, @0xd0, len=0x4) 0x0
1254@1535049804.098852:vfio_pci_read_config  (0000:01:00.0, @0xd4, len=0x4) 0x0
1254@1535049804.098865:vfio_pci_read_config  (0000:01:00.0, @0xd8, len=0x4) 0x0
1254@1535049804.098879:vfio_pci_read_config  (0000:01:00.0, @0xdc, len=0x4) 0x0
1254@1535049804.098893:vfio_pci_read_config  (0000:01:00.0, @0xe0, len=0x4) 0x0
1254@1535049804.098908:vfio_pci_read_config  (0000:01:00.0, @0xe4, len=0x4) 0x0
1254@1535049804.098922:vfio_pci_read_config  (0000:01:00.0, @0xe8, len=0x4) 0x0
1254@1535049804.098934:vfio_pci_read_config  (0000:01:00.0, @0xec, len=0x4) 0x0
1254@1535049804.098946:vfio_pci_read_config  (0000:01:00.0, @0xf0, len=0x4) 0x0
1254@1535049804.098958:vfio_pci_read_config  (0000:01:00.0, @0xf4, len=0x4) 0x0
1254@1535049804.098969:vfio_pci_read_config  (0000:01:00.0, @0xf8, len=0x4) 0x0
1254@1535049804.098980:vfio_pci_read_config  (0000:01:00.0, @0xfc, len=0x4) 0x0
1254@1535049804.100201:vfio_pci_read_config  (0000:01:00.0, @0x0, len=0x4) 0x1c8d10de
1254@1535049804.100215:vfio_pci_read_config  (0000:01:00.0, @0x4, len=0x4) 0x100103
1254@1535049804.100227:vfio_pci_read_config  (0000:01:00.0, @0x8, len=0x4) 0x30200a1
1254@1535049804.100239:vfio_pci_read_config  (0000:01:00.0, @0xc, len=0x4) 0x0
1254@1535049804.100250:vfio_pci_read_config  (0000:01:00.0, @0x10, len=0x4) 0xfd000000
1254@1535049804.100260:vfio_pci_read_config  (0000:01:00.0, @0x14, len=0x4) 0xd000000c
1254@1535049804.100269:vfio_pci_read_config  (0000:01:00.0, @0x18, len=0x4) 0x0
1254@1535049804.100279:vfio_pci_read_config  (0000:01:00.0, @0x1c, len=0x4) 0xe000000c
1254@1535049804.100288:vfio_pci_read_config  (0000:01:00.0, @0x20, len=0x4) 0x0
1254@1535049804.100299:vfio_pci_read_config  (0000:01:00.0, @0x24, len=0x4) 0xc001
1254@1535049804.100312:vfio_pci_read_config  (0000:01:00.0, @0x28, len=0x4) 0x0
1254@1535049804.100324:vfio_pci_read_config  (0000:01:00.0, @0x2c, len=0x4) 0x7be1028
1254@1535049804.100335:vfio_pci_read_config  (0000:01:00.0, @0x30, len=0x4) 0x0
1254@1535049804.100349:vfio_pci_read_config  (0000:01:00.0, @0x34, len=0x4) 0x60
1254@1535049804.100362:vfio_pci_read_config  (0000:01:00.0, @0x38, len=0x4) 0x0
1254@1535049804.100376:vfio_pci_read_config  (0000:01:00.0, @0x3c, len=0x4) 0x10a
1254@1535049804.100390:vfio_pci_read_config  (0000:01:00.0, @0x40, len=0x4) 0x0
1254@1535049804.100404:vfio_pci_read_config  (0000:01:00.0, @0x44, len=0x4) 0x0
1254@1535049804.100418:vfio_pci_read_config  (0000:01:00.0, @0x48, len=0x4) 0x0
1254@1535049804.100432:vfio_pci_read_config  (0000:01:00.0, @0x4c, len=0x4) 0x0
1254@1535049804.100445:vfio_pci_read_config  (0000:01:00.0, @0x50, len=0x4) 0x0
1254@1535049804.100459:vfio_pci_read_config  (0000:01:00.0, @0x54, len=0x4) 0x1
1254@1535049804.100473:vfio_pci_read_config  (0000:01:00.0, @0x58, len=0x4) 0x23d6ce
1254@1535049804.100487:vfio_pci_read_config  (0000:01:00.0, @0x5c, len=0x4) 0x0
1254@1535049804.100501:vfio_pci_read_config  (0000:01:00.0, @0x60, len=0x4) 0x36801
1254@1535049804.100515:vfio_pci_read_config  (0000:01:00.0, @0x64, len=0x4) 0x8
1254@1535049804.100527:vfio_pci_read_config  (0000:01:00.0, @0x68, len=0x4) 0x807805
1254@1535049804.100539:vfio_pci_read_config  (0000:01:00.0, @0x6c, len=0x4) 0x0
1254@1535049804.100552:vfio_pci_read_config  (0000:01:00.0, @0x70, len=0x4) 0x0
1254@1535049804.100566:vfio_pci_read_config  (0000:01:00.0, @0x74, len=0x4) 0x0
1254@1535049804.100580:vfio_pci_read_config  (0000:01:00.0, @0x78, len=0x4) 0x20010
1254@1535049804.100594:vfio_pci_read_config  (0000:01:00.0, @0x7c, len=0x4) 0x12c8de1
1254@1535049804.100608:vfio_pci_read_config  (0000:01:00.0, @0x80, len=0x4) 0x2930
1254@1535049804.100622:vfio_pci_read_config  (0000:01:00.0, @0x84, len=0x4) 0x454d03
1254@1535049804.100636:vfio_pci_read_config  (0000:01:00.0, @0x88, len=0x4) 0x11030040
1254@1535049804.100649:vfio_pci_read_config  (0000:01:00.0, @0x8c, len=0x4) 0x0
1254@1535049804.100664:vfio_pci_read_config  (0000:01:00.0, @0x90, len=0x4) 0x0
1254@1535049804.100678:vfio_pci_read_config  (0000:01:00.0, @0x94, len=0x4) 0x0
1254@1535049804.100693:vfio_pci_read_config  (0000:01:00.0, @0x98, len=0x4) 0x0
1254@1535049804.100706:vfio_pci_read_config  (0000:01:00.0, @0x9c, len=0x4) 0x40813
1254@1535049804.100721:vfio_pci_read_config  (0000:01:00.0, @0xa0, len=0x4) 0x400
1254@1535049804.100740:vfio_pci_read_config  (0000:01:00.0, @0xa4, len=0x4) 0xe
1254@1535049804.100754:vfio_pci_read_config  (0000:01:00.0, @0xa8, len=0x4) 0x1f0003
1254@1535049804.100768:vfio_pci_read_config  (0000:01:00.0, @0xac, len=0x4) 0x0
1254@1535049804.100782:vfio_pci_read_config  (0000:01:00.0, @0xb0, len=0x4) 0x0
1254@1535049804.100795:vfio_pci_read_config  (0000:01:00.0, @0xb4, len=0x4) 0x1140009
1254@1535049804.100809:vfio_pci_read_config  (0000:01:00.0, @0xb8, len=0x4) 0x0
1254@1535049804.100823:vfio_pci_read_config  (0000:01:00.0, @0xbc, len=0x4) 0x0
1254@1535049804.100838:vfio_pci_read_config  (0000:01:00.0, @0xc0, len=0x4) 0x0
1254@1535049804.100852:vfio_pci_read_config  (0000:01:00.0, @0xc4, len=0x4) 0x0
1254@1535049804.100866:vfio_pci_read_config  (0000:01:00.0, @0xc8, len=0x4) 0x0
1254@1535049804.100880:vfio_pci_read_config  (0000:01:00.0, @0xcc, len=0x4) 0x0
1254@1535049804.100894:vfio_pci_read_config  (0000:01:00.0, @0xd0, len=0x4) 0x0
1254@1535049804.100908:vfio_pci_read_config  (0000:01:00.0, @0xd4, len=0x4) 0x0
1254@1535049804.100921:vfio_pci_read_config  (0000:01:00.0, @0xd8, len=0x4) 0x0
1254@1535049804.100936:vfio_pci_read_config  (0000:01:00.0, @0xdc, len=0x4) 0x0
1254@1535049804.100950:vfio_pci_read_config  (0000:01:00.0, @0xe0, len=0x4) 0x0
1254@1535049804.100961:vfio_pci_read_config  (0000:01:00.0, @0xe4, len=0x4) 0x0
1254@1535049804.100975:vfio_pci_read_config  (0000:01:00.0, @0xe8, len=0x4) 0x0
1254@1535049804.100986:vfio_pci_read_config  (0000:01:00.0, @0xec, len=0x4) 0x0
1254@1535049804.100998:vfio_pci_read_config  (0000:01:00.0, @0xf0, len=0x4) 0x0
1254@1535049804.101010:vfio_pci_read_config  (0000:01:00.0, @0xf4, len=0x4) 0x0
1254@1535049804.101021:vfio_pci_read_config  (0000:01:00.0, @0xf8, len=0x4) 0x0
1254@1535049804.101033:vfio_pci_read_config  (0000:01:00.0, @0xfc, len=0x4) 0x0
1254@1535049804.104415:vfio_pci_read_config  (0000:01:00.0, @0x0, len=0x4) 0x1c8d10de
1254@1535049804.104432:vfio_pci_read_config  (0000:01:00.0, @0x4, len=0x4) 0x100103
1254@1535049804.104446:vfio_pci_read_config  (0000:01:00.0, @0x8, len=0x4) 0x30200a1
1254@1535049804.104479:vfio_pci_read_config  (0000:01:00.0, @0xc, len=0x4) 0x0
1254@1535049804.104491:vfio_pci_read_config  (0000:01:00.0, @0x10, len=0x4) 0xfd000000
1254@1535049804.104503:vfio_pci_read_config  (0000:01:00.0, @0x14, len=0x4) 0xd000000c
1254@1535049804.104514:vfio_pci_read_config  (0000:01:00.0, @0x18, len=0x4) 0x0
1254@1535049804.104524:vfio_pci_read_config  (0000:01:00.0, @0x1c, len=0x4) 0xe000000c
1254@1535049804.104533:vfio_pci_read_config  (0000:01:00.0, @0x20, len=0x4) 0x0
1254@1535049804.104544:vfio_pci_read_config  (0000:01:00.0, @0x24, len=0x4) 0xc001
1254@1535049804.104557:vfio_pci_read_config  (0000:01:00.0, @0x28, len=0x4) 0x0
1254@1535049804.104570:vfio_pci_read_config  (0000:01:00.0, @0x2c, len=0x4) 0x7be1028
1254@1535049804.104581:vfio_pci_read_config  (0000:01:00.0, @0x30, len=0x4) 0x0
1254@1535049804.104595:vfio_pci_read_config  (0000:01:00.0, @0x34, len=0x4) 0x60
1254@1535049804.104608:vfio_pci_read_config  (0000:01:00.0, @0x38, len=0x4) 0x0
1254@1535049804.104622:vfio_pci_read_config  (0000:01:00.0, @0x3c, len=0x4) 0x10a
1254@1535049804.104637:vfio_pci_read_config  (0000:01:00.0, @0x40, len=0x4) 0x0
1254@1535049804.104651:vfio_pci_read_config  (0000:01:00.0, @0x44, len=0x4) 0x0
1254@1535049804.104665:vfio_pci_read_config  (0000:01:00.0, @0x48, len=0x4) 0x0
1254@1535049804.104680:vfio_pci_read_config  (0000:01:00.0, @0x4c, len=0x4) 0x0
1254@1535049804.104694:vfio_pci_read_config  (0000:01:00.0, @0x50, len=0x4) 0x0
1254@1535049804.104708:vfio_pci_read_config  (0000:01:00.0, @0x54, len=0x4) 0x1
1254@1535049804.104722:vfio_pci_read_config  (0000:01:00.0, @0x58, len=0x4) 0x23d6ce
1254@1535049804.104741:vfio_pci_read_config  (0000:01:00.0, @0x5c, len=0x4) 0x0
1254@1535049804.104755:vfio_pci_read_config  (0000:01:00.0, @0x60, len=0x4) 0x36801
1254@1535049804.104769:vfio_pci_read_config  (0000:01:00.0, @0x64, len=0x4) 0x8
1254@1535049804.104781:vfio_pci_read_config  (0000:01:00.0, @0x68, len=0x4) 0x807805
1254@1535049804.104794:vfio_pci_read_config  (0000:01:00.0, @0x6c, len=0x4) 0x0
1254@1535049804.104806:vfio_pci_read_config  (0000:01:00.0, @0x70, len=0x4) 0x0
1254@1535049804.104819:vfio_pci_read_config  (0000:01:00.0, @0x74, len=0x4) 0x0
1254@1535049804.104833:vfio_pci_read_config  (0000:01:00.0, @0x78, len=0x4) 0x20010
1254@1535049804.104847:vfio_pci_read_config  (0000:01:00.0, @0x7c, len=0x4) 0x12c8de1
1254@1535049804.104861:vfio_pci_read_config  (0000:01:00.0, @0x80, len=0x4) 0x2930
1254@1535049804.104875:vfio_pci_read_config  (0000:01:00.0, @0x84, len=0x4) 0x454d03
1254@1535049804.104889:vfio_pci_read_config  (0000:01:00.0, @0x88, len=0x4) 0x11030040
1254@1535049804.104903:vfio_pci_read_config  (0000:01:00.0, @0x8c, len=0x4) 0x0
1254@1535049804.104917:vfio_pci_read_config  (0000:01:00.0, @0x90, len=0x4) 0x0
1254@1535049804.104930:vfio_pci_read_config  (0000:01:00.0, @0x94, len=0x4) 0x0
1254@1535049804.104944:vfio_pci_read_config  (0000:01:00.0, @0x98, len=0x4) 0x0
1254@1535049804.104958:vfio_pci_read_config  (0000:01:00.0, @0x9c, len=0x4) 0x40813
1254@1535049804.104971:vfio_pci_read_config  (0000:01:00.0, @0xa0, len=0x4) 0x400
1254@1535049804.104985:vfio_pci_read_config  (0000:01:00.0, @0xa4, len=0x4) 0xe
1254@1535049804.104999:vfio_pci_read_config  (0000:01:00.0, @0xa8, len=0x4) 0x1f0003
1254@1535049804.105011:vfio_pci_read_config  (0000:01:00.0, @0xac, len=0x4) 0x0
1254@1535049804.105024:vfio_pci_read_config  (0000:01:00.0, @0xb0, len=0x4) 0x0
1254@1535049804.105037:vfio_pci_read_config  (0000:01:00.0, @0xb4, len=0x4) 0x1140009
1254@1535049804.105051:vfio_pci_read_config  (0000:01:00.0, @0xb8, len=0x4) 0x0
1254@1535049804.105065:vfio_pci_read_config  (0000:01:00.0, @0xbc, len=0x4) 0x0
1254@1535049804.105079:vfio_pci_read_config  (0000:01:00.0, @0xc0, len=0x4) 0x0
1254@1535049804.105093:vfio_pci_read_config  (0000:01:00.0, @0xc4, len=0x4) 0x0
1254@1535049804.105106:vfio_pci_read_config  (0000:01:00.0, @0xc8, len=0x4) 0x0
1254@1535049804.105121:vfio_pci_read_config  (0000:01:00.0, @0xcc, len=0x4) 0x0
1254@1535049804.105135:vfio_pci_read_config  (0000:01:00.0, @0xd0, len=0x4) 0x0
1254@1535049804.105149:vfio_pci_read_config  (0000:01:00.0, @0xd4, len=0x4) 0x0
1254@1535049804.105163:vfio_pci_read_config  (0000:01:00.0, @0xd8, len=0x4) 0x0
1254@1535049804.105177:vfio_pci_read_config  (0000:01:00.0, @0xdc, len=0x4) 0x0
1254@1535049804.105190:vfio_pci_read_config  (0000:01:00.0, @0xe0, len=0x4) 0x0
1254@1535049804.105203:vfio_pci_read_config  (0000:01:00.0, @0xe4, len=0x4) 0x0
1254@1535049804.105218:vfio_pci_read_config  (0000:01:00.0, @0xe8, len=0x4) 0x0
1254@1535049804.105231:vfio_pci_read_config  (0000:01:00.0, @0xec, len=0x4) 0x0
1254@1535049804.105245:vfio_pci_read_config  (0000:01:00.0, @0xf0, len=0x4) 0x0
1254@1535049804.105259:vfio_pci_read_config  (0000:01:00.0, @0xf4, len=0x4) 0x0
1254@1535049804.105273:vfio_pci_read_config  (0000:01:00.0, @0xf8, len=0x4) 0x0
1254@1535049804.105287:vfio_pci_read_config  (0000:01:00.0, @0xfc, len=0x4) 0x0
1254@1535049804.105312:vfio_pci_read_config  (0000:01:00.0, @0x0, len=0x4) 0x1c8d10de
1254@1535049804.105326:vfio_pci_read_config  (0000:01:00.0, @0x4, len=0x4) 0x100103
1254@1535049804.105370:vfio_pci_read_config  (0000:01:00.0, @0x8, len=0x4) 0x30200a1
1254@1535049804.105395:vfio_pci_read_config  (0000:01:00.0, @0xc, len=0x4) 0x0
1254@1535049804.105596:vfio_pci_read_config  (0000:01:00.0, @0x10, len=0x4) 0xfd000000
1254@1535049804.105628:vfio_pci_read_config  (0000:01:00.0, @0x14, len=0x4) 0xd000000c
1254@1535049804.105640:vfio_pci_read_config  (0000:01:00.0, @0x18, len=0x4) 0x0
1254@1535049804.105650:vfio_pci_read_config  (0000:01:00.0, @0x1c, len=0x4) 0xe000000c
1254@1535049804.105661:vfio_pci_read_config  (0000:01:00.0, @0x20, len=0x4) 0x0
1254@1535049804.105690:vfio_pci_read_config  (0000:01:00.0, @0x24, len=0x4) 0xc001
1254@1535049804.105701:vfio_pci_read_config  (0000:01:00.0, @0x28, len=0x4) 0x0
1254@1535049804.105712:vfio_pci_read_config  (0000:01:00.0, @0x2c, len=0x4) 0x7be1028
1254@1535049804.105723:vfio_pci_read_config  (0000:01:00.0, @0x30, len=0x4) 0x0
1254@1535049804.105741:vfio_pci_read_config  (0000:01:00.0, @0x34, len=0x4) 0x60
1254@1535049804.105752:vfio_pci_read_config  (0000:01:00.0, @0x38, len=0x4) 0x0
1254@1535049804.105765:vfio_pci_read_config  (0000:01:00.0, @0x3c, len=0x4) 0x10a
1254@1535049804.105791:vfio_pci_read_config  (0000:01:00.0, @0x40, len=0x4) 0x0
1254@1535049804.105822:vfio_pci_read_config  (0000:01:00.0, @0x44, len=0x4) 0x0
1254@1535049804.105836:vfio_pci_read_config  (0000:01:00.0, @0x48, len=0x4) 0x0
1254@1535049804.105850:vfio_pci_read_config  (0000:01:00.0, @0x4c, len=0x4) 0x0
1254@1535049804.105875:vfio_pci_read_config  (0000:01:00.0, @0x50, len=0x4) 0x0
1254@1535049804.105906:vfio_pci_read_config  (0000:01:00.0, @0x54, len=0x4) 0x1
1254@1535049804.105920:vfio_pci_read_config  (0000:01:00.0, @0x58, len=0x4) 0x23d6ce
1254@1535049804.105933:vfio_pci_read_config  (0000:01:00.0, @0x5c, len=0x4) 0x0
1254@1535049804.105977:vfio_pci_read_config  (0000:01:00.0, @0x60, len=0x4) 0x36801
1254@1535049804.105990:vfio_pci_read_config  (0000:01:00.0, @0x64, len=0x4) 0x8
1254@1535049804.106002:vfio_pci_read_config  (0000:01:00.0, @0x68, len=0x4) 0x807805
1254@1535049804.106014:vfio_pci_read_config  (0000:01:00.0, @0x6c, len=0x4) 0x0
1254@1535049804.106038:vfio_pci_read_config  (0000:01:00.0, @0x70, len=0x4) 0x0
1254@1535049804.106069:vfio_pci_read_config  (0000:01:00.0, @0x74, len=0x4) 0x0
1254@1535049804.106083:vfio_pci_read_config  (0000:01:00.0, @0x78, len=0x4) 0x20010
1254@1535049804.106095:vfio_pci_read_config  (0000:01:00.0, @0x7c, len=0x4) 0x12c8de1
1254@1535049804.106121:vfio_pci_read_config  (0000:01:00.0, @0x80, len=0x4) 0x2930
1254@1535049804.106154:vfio_pci_read_config  (0000:01:00.0, @0x84, len=0x4) 0x454d03
1254@1535049804.106168:vfio_pci_read_config  (0000:01:00.0, @0x88, len=0x4) 0x11030040
1254@1535049804.106194:vfio_pci_read_config  (0000:01:00.0, @0x8c, len=0x4) 0x0
1254@1535049804.106227:vfio_pci_read_config  (0000:01:00.0, @0x90, len=0x4) 0x0
1254@1535049804.106240:vfio_pci_read_config  (0000:01:00.0, @0x94, len=0x4) 0x0
1254@1535049804.106254:vfio_pci_read_config  (0000:01:00.0, @0x98, len=0x4) 0x0
1254@1535049804.106279:vfio_pci_read_config  (0000:01:00.0, @0x9c, len=0x4) 0x40813
1254@1535049804.106311:vfio_pci_read_config  (0000:01:00.0, @0xa0, len=0x4) 0x400
1254@1535049804.106324:vfio_pci_read_config  (0000:01:00.0, @0xa4, len=0x4) 0xe
1254@1535049804.106335:vfio_pci_read_config  (0000:01:00.0, @0xa8, len=0x4) 0x1f0003
1254@1535049804.106346:vfio_pci_read_config  (0000:01:00.0, @0xac, len=0x4) 0x0
1254@1535049804.106357:vfio_pci_read_config  (0000:01:00.0, @0xb0, len=0x4) 0x0
1254@1535049804.106381:vfio_pci_read_config  (0000:01:00.0, @0xb4, len=0x4) 0x1140009
1254@1535049804.106413:vfio_pci_read_config  (0000:01:00.0, @0xb8, len=0x4) 0x0
1254@1535049804.106426:vfio_pci_read_config  (0000:01:00.0, @0xbc, len=0x4) 0x0
1254@1535049804.106440:vfio_pci_read_config  (0000:01:00.0, @0xc0, len=0x4) 0x0
1254@1535049804.106466:vfio_pci_read_config  (0000:01:00.0, @0xc4, len=0x4) 0x0
1254@1535049804.106499:vfio_pci_read_config  (0000:01:00.0, @0xc8, len=0x4) 0x0
1254@1535049804.106513:vfio_pci_read_config  (0000:01:00.0, @0xcc, len=0x4) 0x0
1254@1535049804.106538:vfio_pci_read_config  (0000:01:00.0, @0xd0, len=0x4) 0x0
1254@1535049804.106571:vfio_pci_read_config  (0000:01:00.0, @0xd4, len=0x4) 0x0
1254@1535049804.106585:vfio_pci_read_config  (0000:01:00.0, @0xd8, len=0x4) 0x0
1254@1535049804.106598:vfio_pci_read_config  (0000:01:00.0, @0xdc, len=0x4) 0x0
1254@1535049804.106612:vfio_pci_read_config  (0000:01:00.0, @0xe0, len=0x4) 0x0
1254@1535049804.106627:vfio_pci_read_config  (0000:01:00.0, @0xe4, len=0x4) 0x0
1254@1535049804.106641:vfio_pci_read_config  (0000:01:00.0, @0xe8, len=0x4) 0x0
1254@1535049804.106654:vfio_pci_read_config  (0000:01:00.0, @0xec, len=0x4) 0x0
1254@1535049804.106668:vfio_pci_read_config  (0000:01:00.0, @0xf0, len=0x4) 0x0
1254@1535049804.106682:vfio_pci_read_config  (0000:01:00.0, @0xf4, len=0x4) 0x0
1254@1535049804.106696:vfio_pci_read_config  (0000:01:00.0, @0xf8, len=0x4) 0x0
1254@1535049804.106710:vfio_pci_read_config  (0000:01:00.0, @0xfc, len=0x4) 0x0
1254@1535049804.106743:vfio_pci_read_config  (0000:01:00.0, @0x0, len=0x4) 0x1c8d10de
1254@1535049804.106770:vfio_pci_read_config  (0000:01:00.0, @0x4, len=0x4) 0x100103
1254@1535049804.106802:vfio_pci_read_config  (0000:01:00.0, @0x8, len=0x4) 0x30200a1
1254@1535049804.106816:vfio_pci_read_config  (0000:01:00.0, @0xc, len=0x4) 0x0
1254@1535049804.106828:vfio_pci_read_config  (0000:01:00.0, @0x10, len=0x4) 0xfd000000
1254@1535049804.106866:vfio_pci_read_config  (0000:01:00.0, @0x14, len=0x4) 0xd000000c
1254@1535049804.106878:vfio_pci_read_config  (0000:01:00.0, @0x18, len=0x4) 0x0
1254@1535049804.106891:vfio_pci_read_config  (0000:01:00.0, @0x1c, len=0x4) 0xe000000c
1254@1535049804.106902:vfio_pci_read_config  (0000:01:00.0, @0x20, len=0x4) 0x0
1254@1535049804.106914:vfio_pci_read_config  (0000:01:00.0, @0x24, len=0x4) 0xc001
1254@1535049804.106928:vfio_pci_read_config  (0000:01:00.0, @0x28, len=0x4) 0x0
1254@1535049804.106940:vfio_pci_read_config  (0000:01:00.0, @0x2c, len=0x4) 0x7be1028
1254@1535049804.106953:vfio_pci_read_config  (0000:01:00.0, @0x30, len=0x4) 0x0
1254@1535049804.106967:vfio_pci_read_config  (0000:01:00.0, @0x34, len=0x4) 0x60
1254@1535049804.106979:vfio_pci_read_config  (0000:01:00.0, @0x38, len=0x4) 0x0
1254@1535049804.106992:vfio_pci_read_config  (0000:01:00.0, @0x3c, len=0x4) 0x10a
1254@1535049804.136605:vfio_pci_read_config  (0000:01:00.0, @0x0, len=0x4) 0x1c8d10de
1254@1535049804.136646:vfio_pci_read_config  (0000:01:00.0, @0x4, len=0x4) 0x100103
1254@1535049804.136659:vfio_pci_read_config  (0000:01:00.0, @0x8, len=0x4) 0x30200a1
1254@1535049804.136670:vfio_pci_read_config  (0000:01:00.0, @0xc, len=0x4) 0x0
1254@1535049804.136680:vfio_pci_read_config  (0000:01:00.0, @0x10, len=0x4) 0xfd000000
1254@1535049804.136689:vfio_pci_read_config  (0000:01:00.0, @0x14, len=0x4) 0xd000000c
1254@1535049804.136698:vfio_pci_read_config  (0000:01:00.0, @0x18, len=0x4) 0x0
1254@1535049804.136707:vfio_pci_read_config  (0000:01:00.0, @0x1c, len=0x4) 0xe000000c
1254@1535049804.136718:vfio_pci_read_config  (0000:01:00.0, @0x20, len=0x4) 0x0
1254@1535049804.136735:vfio_pci_read_config  (0000:01:00.0, @0x24, len=0x4) 0xc001
1254@1535049804.136749:vfio_pci_read_config  (0000:01:00.0, @0x28, len=0x4) 0x0
1254@1535049804.136761:vfio_pci_read_config  (0000:01:00.0, @0x2c, len=0x4) 0x7be1028
1254@1535049804.136772:vfio_pci_read_config  (0000:01:00.0, @0x30, len=0x4) 0x0
1254@1535049804.136788:vfio_pci_read_config  (0000:01:00.0, @0x34, len=0x4) 0x60
1254@1535049804.136820:vfio_pci_read_config  (0000:01:00.0, @0x38, len=0x4) 0x0
1254@1535049804.136834:vfio_pci_read_config  (0000:01:00.0, @0x3c, len=0x4) 0x10a
1254@1535049804.144590:vfio_pci_read_config  (0000:01:00.0, @0x0, len=0x4) 0x1c8d10de
1254@1535049804.144606:vfio_pci_read_config  (0000:01:00.0, @0x4, len=0x4) 0x100103
1254@1535049804.144637:vfio_pci_read_config  (0000:01:00.0, @0x8, len=0x4) 0x30200a1
1254@1535049804.144650:vfio_pci_read_config  (0000:01:00.0, @0xc, len=0x4) 0x0
1254@1535049804.144661:vfio_pci_read_config  (0000:01:00.0, @0x10, len=0x4) 0xfd000000
1254@1535049804.144691:vfio_pci_read_config  (0000:01:00.0, @0x14, len=0x4) 0xd000000c
1254@1535049804.144702:vfio_pci_read_config  (0000:01:00.0, @0x18, len=0x4) 0x0
1254@1535049804.144711:vfio_pci_read_config  (0000:01:00.0, @0x1c, len=0x4) 0xe000000c
1254@1535049804.144720:vfio_pci_read_config  (0000:01:00.0, @0x20, len=0x4) 0x0
1254@1535049804.144733:vfio_pci_read_config  (0000:01:00.0, @0x24, len=0x4) 0xc001
1254@1535049804.144764:vfio_pci_read_config  (0000:01:00.0, @0x28, len=0x4) 0x0
1254@1535049804.144773:vfio_pci_read_config  (0000:01:00.0, @0x2c, len=0x4) 0x7be1028
1254@1535049804.144784:vfio_pci_read_config  (0000:01:00.0, @0x30, len=0x4) 0x0
1254@1535049804.144808:vfio_pci_read_config  (0000:01:00.0, @0x34, len=0x4) 0x60
1254@1535049804.144839:vfio_pci_read_config  (0000:01:00.0, @0x38, len=0x4) 0x0
1254@1535049804.144851:vfio_pci_read_config  (0000:01:00.0, @0x3c, len=0x4) 0x10a
1254@1535049804.144981:vfio_pci_write_config  (0000:01:00.0, @0x3c, 0x0, len=0x1)
1254@1535049804.145358:vfio_pci_write_config  (0000:01:00.0, @0x3c, 0x0, len=0x1)
1254@1535049804.145605:vfio_pci_write_config  (0000:01:00.0, @0x3c, 0x0, len=0x1)
1254@1535049804.145800:vfio_pci_write_config  (0000:01:00.0, @0x3c, 0x0, len=0x1)
NET._PS0
1254@1535049804.289679:vfio_pci_read_config  (0000:01:00.0, @0x0, len=0x2) 0x10de
1254@1535049804.289728:vfio_pci_read_config  (0000:01:00.0, @0x2, len=0x2) 0x1c8d
1254@1535049804.289768:vfio_pci_read_config  (0000:01:00.0, @0x8, len=0x1) 0xa1
1254@1535049804.289807:vfio_pci_read_config  (0000:01:00.0, @0x9, len=0x1) 0x0
1254@1535049804.289818:vfio_pci_read_config  (0000:01:00.0, @0xa, len=0x1) 0x2
1254@1535049804.289848:vfio_pci_read_config  (0000:01:00.0, @0xb, len=0x1) 0x3
1254@1535049804.289860:vfio_pci_read_config  (0000:01:00.0, @0xe, len=0x1) 0x0
1254@1535049804.289871:vfio_pci_read_config  (0000:01:00.0, @0x2c, len=0x2) 0x1028
1254@1535049804.289881:vfio_pci_read_config  (0000:01:00.0, @0x2e, len=0x2) 0x7be
1254@1535049804.289912:vfio_pci_read_config  (0000:01:00.0, @0x60, len=0x4) 0x36801
1254@1535049804.289925:vfio_pci_read_config  (0000:01:00.0, @0x64, len=0x4) 0x8
1254@1535049804.289950:vfio_pci_write_config  (0000:01:00.0, @0x64, 0x8, len=0x2)
1254@1535049804.319952:vfio_pci_read_config  (0000:01:00.0, @0x64, len=0x2) 0x8
1254@1535049804.320045:vfio_pci_read_config  (0000:01:00.0, @0x4, len=0x2) 0x103
1254@1535049804.320078:vfio_pci_write_config  (0000:01:00.0, @0x4, 0x500, len=0x2)
1254@1535049804.324187:vfio_pci_write_config  (0000:01:00.0, @0x10, 0xfd000000, len=0x4)
1254@1535049804.324223:vfio_pci_write_config  (0000:01:00.0, @0x14, 0xd0000000, len=0x4)
1254@1535049804.324237:vfio_pci_write_config  (0000:01:00.0, @0x18, 0x0, len=0x4)
1254@1535049804.324250:vfio_pci_write_config  (0000:01:00.0, @0x1c, 0xe0000000, len=0x4)
1254@1535049804.324262:vfio_pci_write_config  (0000:01:00.0, @0x20, 0x0, len=0x4)
1254@1535049804.324292:vfio_pci_write_config  (0000:01:00.0, @0x24, 0xc000, len=0x4)
1254@1535049804.324306:vfio_pci_write_config  (0000:01:00.0, @0x30, 0x0, len=0x4)
1254@1535049804.324319:vfio_pci_write_config  (0000:01:00.0, @0x3c, 0x0, len=0x1)
1254@1535049804.324331:vfio_pci_write_config  (0000:01:00.0, @0xc, 0x0, len=0x1)
1254@1535049804.324366:vfio_pci_write_config  (0000:01:00.0, @0xd, 0x0, len=0x1)
1254@1535049804.324381:vfio_pci_write_config  (0000:01:00.0, @0x4, 0x500, len=0x2)
1254@1535049804.324433:vfio_pci_write_config  (0000:01:00.0, @0x80, 0x2117, len=0x2)
1254@1535049804.324453:vfio_pci_write_config  (0000:01:00.0, @0x88, 0x40, len=0x2)
1254@1535049804.324501:vfio_pci_read_config  (0000:01:00.0, @0x4, len=0x2) 0x500
1254@1535049804.324515:vfio_pci_write_config  (0000:01:00.0, @0x4, 0x507, len=0x2)
1254@1535049804.336700:vfio_pci_write_config  (0000:01:00.0, @0x6, 0xf900, len=0x2)
1254@1535049804.337355:vfio_pci_read_config  (0000:01:00.0, @0x4, len=0x2) 0x507
1254@1535049804.337390:vfio_pci_write_config  (0000:01:00.0, @0x4, 0x507, len=0x2)
1254@1535049804.337409:vfio_pci_read_config  (0000:01:00.0, @0x6a, len=0x2) 0x80
1254@1535049804.337422:vfio_pci_write_config  (0000:01:00.0, @0x6a, 0x80, len=0x2)
1254@1535049804.337468:vfio_pci_read_config  (0000:01:00.0, @0x6a, len=0x2) 0x80
1254@1535049804.337482:vfio_pci_write_config  (0000:01:00.0, @0x6c, 0xfee00000, len=0x4)
1254@1535049804.337507:vfio_pci_write_config  (0000:01:00.0, @0x70, 0x0, len=0x4)
1254@1535049804.337538:vfio_pci_write_config  (0000:01:00.0, @0x74, 0x4070, len=0x2)
1254@1535049804.337551:vfio_pci_write_config  (0000:01:00.0, @0x6a, 0x81, len=0x2)
1254@1535049804.569082:vfio_pci_write_config  (0000:01:00.0, @0x3c, 0x0, len=0x1)
1254@1535049805.261685:vfio_pci_write_config  (0000:01:00.0, @0x88, 0x41, len=0x2)

Thu, 23 Aug 2018 20:43:38 +0200
1254@1535049946.578749:vfio_pci_read_config  (0000:01:00.0, @0x0, len=0x2) 0x10de
1254@1535049946.578792:vfio_pci_read_config  (0000:01:00.0, @0x2, len=0x2) 0x1c8d
1254@1535049946.578814:vfio_pci_read_config  (0000:01:00.0, @0x8, len=0x1) 0xa1
1254@1535049946.578833:vfio_pci_read_config  (0000:01:00.0, @0x9, len=0x1) 0x0
1254@1535049946.578877:vfio_pci_read_config  (0000:01:00.0, @0xa, len=0x1) 0x2
1254@1535049946.578892:vfio_pci_read_config  (0000:01:00.0, @0xb, len=0x1) 0x3
1254@1535049946.578907:vfio_pci_read_config  (0000:01:00.0, @0xe, len=0x1) 0x0
1254@1535049946.578932:vfio_pci_read_config  (0000:01:00.0, @0x2c, len=0x2) 0x1028
1254@1535049946.578962:vfio_pci_read_config  (0000:01:00.0, @0x2e, len=0x2) 0x7be
1254@1535049946.578997:vfio_pci_read_config  (0000:01:00.0, @0x4, len=0x2) 0x507
1254@1535049946.579024:vfio_pci_read_config  (0000:01:00.0, @0xc, len=0x1) 0x0
1254@1535049946.579057:vfio_pci_read_config  (0000:01:00.0, @0xd, len=0x1) 0x0
1254@1535049946.579076:vfio_pci_read_config  (0000:01:00.0, @0x3c, len=0x1) 0x0
1254@1535049946.579104:vfio_pci_read_config  (0000:01:00.0, @0x4, len=0x2) 0x507
1254@1535049946.579136:vfio_pci_write_config  (0000:01:00.0, @0x4, 0x507, len=0x2)
1254@1535049946.579173:vfio_pci_read_config  (0000:01:00.0, @0x6a, len=0x2) 0x81
1254@1535049946.579206:vfio_pci_write_config  (0000:01:00.0, @0x6a, 0x80, len=0x2)
1254@1535049946.579413:vfio_pci_read_config  (0000:01:00.0, @0x3d, len=0x1) 0x1
1254@1535049946.579631:vfio_pci_read_config  (0000:01:00.0, @0x4, len=0x2) 0x507
1254@1535049946.579674:vfio_pci_write_config  (0000:01:00.0, @0x4, 0x500, len=0x2)
1254@1535049946.601550:vfio_pci_read_config  (0000:01:00.0, @0x82, len=0x2) 0x0
1254@1535049946.609541:vfio_pci_read_config  (0000:01:00.0, @0x60, len=0x4) 0x36801
1254@1535049946.609560:vfio_pci_read_config  (0000:01:00.0, @0x64, len=0x4) 0x8
1254@1535049946.609590:vfio_pci_write_config  (0000:01:00.0, @0x64, 0xb, len=0x2)
1254@1535049947.637697:vfio_pci_read_config  (0000:01:00.0, @0x64, len=0x2) 0xb
NET._PS3
1254@1535049947.640361:vfio_pci_read_config  (0000:01:00.0, @0x0, len=0x2) 0x10de
1254@1535049947.640380:vfio_pci_read_config  (0000:01:00.0, @0x2, len=0x2) 0x1c8d
1254@1535049947.640395:vfio_pci_read_config  (0000:01:00.0, @0x8, len=0x1) 0xa1
1254@1535049947.640428:vfio_pci_read_config  (0000:01:00.0, @0x9, len=0x1) 0x0
1254@1535049947.640444:vfio_pci_read_config  (0000:01:00.0, @0xa, len=0x1) 0x2
1254@1535049947.640472:vfio_pci_read_config  (0000:01:00.0, @0xb, len=0x1) 0x3
1254@1535049947.640505:vfio_pci_read_config  (0000:01:00.0, @0xe, len=0x1) 0x0
1254@1535049947.640533:vfio_pci_read_config  (0000:01:00.0, @0x2c, len=0x2) 0x1028
1254@1535049947.640544:vfio_pci_read_config  (0000:01:00.0, @0x2e, len=0x2) 0x7be
1254@1535049947.640574:vfio_pci_read_config  (0000:01:00.0, @0x4, len=0x2) 0x500
1254@1535049947.640592:vfio_pci_read_config  (0000:01:00.0, @0x4, len=0x2) 0x500
1254@1535049947.644634:vfio_pci_read_config  (0000:01:00.0, @0x0, len=0x2) 0x10de
1254@1535049947.644650:vfio_pci_read_config  (0000:01:00.0, @0x2, len=0x2) 0x1c8d
1254@1535049947.644684:vfio_pci_read_config  (0000:01:00.0, @0x8, len=0x1) 0xa1
1254@1535049947.644720:vfio_pci_read_config  (0000:01:00.0, @0x9, len=0x1) 0x0
1254@1535049947.644759:vfio_pci_read_config  (0000:01:00.0, @0xa, len=0x1) 0x2
1254@1535049947.644777:vfio_pci_read_config  (0000:01:00.0, @0xb, len=0x1) 0x3
1254@1535049947.644806:vfio_pci_read_config  (0000:01:00.0, @0xe, len=0x1) 0x0
1254@1535049947.644817:vfio_pci_read_config  (0000:01:00.0, @0x2c, len=0x2) 0x1028
1254@1535049947.644827:vfio_pci_read_config  (0000:01:00.0, @0x2e, len=0x2) 0x7be
1254@1535049947.644845:vfio_pci_read_config  (0000:01:00.0, @0x4, len=0x2) 0x500
1254@1535049947.644880:vfio_pci_write_config  (0000:01:00.0, @0x4, 0x500, len=0x2)
1254@1535049947.644933:vfio_pci_read_config  (0000:01:00.0, @0x6a, len=0x2) 0x80
1254@1535049947.644945:vfio_pci_write_config  (0000:01:00.0, @0x6a, 0x80, len=0x2)
1254@1535049947.644984:vfio_pci_read_config  (0000:01:00.0, @0x82, len=0x2) 0x0
NET._PS3
1254@1535049947.645832:vfio_pci_read_config  (0000:01:00.0, @0x0, len=0x2) 0x10de
1254@1535049947.645847:vfio_pci_read_config  (0000:01:00.0, @0x2, len=0x2) 0x1c8d
1254@1535049947.645864:vfio_pci_read_config  (0000:01:00.0, @0x8, len=0x1) 0xa1
1254@1535049947.645883:vfio_pci_read_config  (0000:01:00.0, @0x9, len=0x1) 0x0
1254@1535049947.645900:vfio_pci_read_config  (0000:01:00.0, @0xa, len=0x1) 0x2
1254@1535049947.645917:vfio_pci_read_config  (0000:01:00.0, @0xb, len=0x1) 0x3
1254@1535049947.645934:vfio_pci_read_config  (0000:01:00.0, @0xe, len=0x1) 0x0
1254@1535049947.645945:vfio_pci_read_config  (0000:01:00.0, @0x2c, len=0x2) 0x1028
1254@1535049947.645957:vfio_pci_read_config  (0000:01:00.0, @0x2e, len=0x2) 0x7be
1254@1535049947.645974:vfio_pci_read_config  (0000:01:00.0, @0x4, len=0x2) 0x500
1254@1535049947.645993:vfio_pci_read_config  (0000:01:00.0, @0x4, len=0x2) 0x500
Thu, 23 Aug 2018 20:45:55 +0200

_PS3
PG00._OFF
PG00._OFF

real	3m48.785s
user	0m49.569s
sys	0m19.635s
Thu, 23 Aug 2018 20:47:01 +0200
